<?xml version="1.0" encoding="UTF-8"?>
<danielpm1982NoteAll:note
	xmlns:xsi="http://www.w3.org/2001/XMLSchema-instance" 
	xsi:schemaLocation="http://www.danielpm1982.com/noteAll NoteAll.xsd"
	xmlns:danielpm1982NoteAll="http://www.danielpm1982.com/noteAll"
	danielpm1982NoteAll:mailId="320">
	<danielpm1982NoteAll:from>citzen1</danielpm1982NoteAll:from>
	<danielpm1982NoteAll:to>citzen2</danielpm1982NoteAll:to>
	<danielpm1982NoteAll:messageText>Hello from citzen1 to citzen2 !</danielpm1982NoteAll:messageText>
	<danielpm1982NoteAll:dateTime>2019-05-01T15:00:00</danielpm1982NoteAll:dateTime>
	<danielpm1982NoteAll:origin>citzen1@citzen.com</danielpm1982NoteAll:origin>
	<danielpm1982NoteAll:destine>citzen2@citzen.com</danielpm1982NoteAll:destine>
	<danielpm1982NoteAll:content>text content1</danielpm1982NoteAll:content>
	<danielpm1982NoteAll:content>text content2</danielpm1982NoteAll:content>
	<danielpm1982NoteAll:content>text content3</danielpm1982NoteAll:content>
</danielpm1982NoteAll:note>
